package,published,title,depends_count,suggests_count,tidyverse_happy,has_vignette_build,has_tests,reverse_count,dl_last_month,ci,test_coverage,forks,stars,watchers,last_commit,last_issue_closed,contributors
cartography,2018-06-25,Thematic Cartography,1,4,FALSE,TRUE,FALSE,0,1163,Travis,NONE,24,182,21,0.13333333333333333,5.8,5
ggplot2,2018-07-03,Create Elegant Data Visualisations Using the Grammar of Graphics,1,19,TRUE,TRUE,TRUE,1370,512968,"Travis, Appveyor",CodeCov,1247,3328,322,0.06666666666666667,0.03333333333333333,157
googleway,2018-05-25,Accesses Google Maps APIs to Retrieve Data and Plot Maps,1,3,TRUE,TRUE,TRUE,1,927,Travis,CodeCov,21,109,9,NA,0,3
ggspatial,2018-07-12,Spatial Data Framework for ggplot2,2,10,TRUE,TRUE,TRUE,0,379,Travis,CodeCov,7,125,12,2.2333333333333334,2.2666666666666666,2
leaflet,2018-08-27,"Create Interactive Web Maps with the JavaScript 'Leaflet'
Library",1,10,TRUE,FALSE,TRUE,39,28490,Travis,NONE,324,491,97,0.23333333333333334,0.2,21
mapview,2018-09-16,Interactive Viewing of Spatial Data in R,2,6,FALSE,FALSE,TRUE,4,10706,Travis,CodeCov,40,181,37,0.03333333333333333,0.03333333333333333,10
plotly,2018-07-20,Create Interactive Web Graphics via 'plotly.js',2,22,TRUE,FALSE,TRUE,77,63679,Travis,NONE,487,1324,119,0.43333333333333335,NA,24
rasterVis,2018-06-02,Visualization Methods for Raster Data,4,4,FALSE,FALSE,FALSE,11,5633,Travis,NONE,12,41,6,NA,4.366666666666666,13
tmap,2018-08-09,Thematic Maps,2,11,FALSE,TRUE,TRUE,1,7228,"Travis, Appveyor",CodeCov,43,258,22,0.1,0.43333333333333335,15
