package,published,title,depends_count,suggests_count,tidyverse_happy,has_vignette_build,has_tests,reverse_count,dl_last_month,ci,test_coverage,forks,stars,watchers,last_commit,last_issue_closed,contributors
cartography,2018-04-30,Thematic Cartography,1,4,FALSE,TRUE,FALSE,0,1986,Travis,NONE,15,95,10,NA,1.4666666666666666,10
ggplot2,2016-12-30,Create Elegant Data Visualisations Using the Grammar of Graphics,1,15,TRUE,TRUE,TRUE,1242,533648,"Travis, Appveyor",CodeCov,1185,3092,314,NA,0,150
googleway,2018-04-29,Accesses Google Maps APIs to Retrieve Data and Plot Maps,1,3,TRUE,TRUE,TRUE,1,2533,Travis,CodeCov,16,87,8,NA,0.06666666666666667,5
leaflet,2018-04-20,"Create Interactive Web Maps with the JavaScript 'Leaflet'
Library",1,10,TRUE,FALSE,TRUE,34,35995,Travis,NONE,297,462,93,NA,0,18
mapview,2018-04-28,Interactive Viewing of Spatial Data in R,2,6,FALSE,FALSE,TRUE,4,13611,Travis,CodeCov,30,160,34,NA,0.1,9
plotly,2017-07-29,Create Interactive Web Graphics via 'plotly.js',2,18,TRUE,FALSE,TRUE,64,65366,Travis,NONE,452,1223,115,NA,0.03333333333333333,24
rasterVis,2018-04-05,Visualization Methods for Raster Data,4,4,FALSE,FALSE,FALSE,10,8288,Travis,NONE,12,35,6,NA,0.03333333333333333,13
tmap,2018-04-10,Thematic Maps,2,7,FALSE,TRUE,FALSE,1,11216,"Travis, Appveyor",NONE,40,215,19,NA,0.03333333333333333,0
