package,published,title,depends_count,suggests_count,tidyverse_happy,has_vignette_build,has_tests,reverse_count,dl_last_month,ci,test_coverage,forks,stars,watchers,last_commit,last_issue_closed,contributors
cartography,2018-06-25,Thematic Cartography,1,4,FALSE,TRUE,FALSE,0,2685,Travis,NONE,15,108,11,0.9333333333333333,3.933333333333333,10
ggplot2,2018-07-03,Create Elegant Data Visualisations Using the Grammar of Graphics,1,19,TRUE,TRUE,TRUE,1312,482616,"Travis, Appveyor",CodeCov,1230,3244,317,0,0,156
googleway,2018-05-25,Accesses Google Maps APIs to Retrieve Data and Plot Maps,1,3,TRUE,TRUE,TRUE,1,1108,Travis,CodeCov,17,101,10,0.8333333333333334,0.6,3
ggspatial,2018-07-12,Spatial Data Framework for ggplot2,2,10,TRUE,TRUE,TRUE,0,864,Travis,CodeCov,7,114,9,0.36666666666666664,0.4,2
leaflet,2018-06-04,"Create Interactive Web Maps with the JavaScript 'Leaflet'
Library",1,10,TRUE,FALSE,TRUE,36,26135,Travis,NONE,315,480,94,0.13333333333333333,0.8666666666666667,6
mapview,2018-04-28,Interactive Viewing of Spatial Data in R,2,6,FALSE,FALSE,TRUE,4,7898,Travis,CodeCov,37,169,34,0.26666666666666666,0.2,1
plotly,2018-07-20,Create Interactive Web Graphics via 'plotly.js',2,22,TRUE,FALSE,TRUE,75,51119,Travis,NONE,478,1276,117,0.23333333333333334,NA,24
rasterVis,2018-06-02,Visualization Methods for Raster Data,4,4,FALSE,FALSE,FALSE,10,5605,Travis,NONE,12,38,6,2.2333333333333334,2.5,13
tmap,2018-07-15,Thematic Maps,2,11,FALSE,TRUE,TRUE,1,7548,"Travis, Appveyor",CodeCov,46,243,18,0.23333333333333334,0.03333333333333333,15
