package,published,title,depends_count,suggests_count,tidyverse_happy,has_vignette_build,has_tests,reverse_count,dl_last_month,ci,test_coverage,forks,stars,watchers,last_commit,last_issue_closed,contributors
cartography,2020-09-02,Thematic Cartography,1,6,FALSE,TRUE,FALSE,1,4189,NONE,CodeCov,38,337,27,1.7,NA,NA
ggplot2,2020-06-19,Create Elegant Data Visualisations Using the Grammar of Graphics,1,20,TRUE,TRUE,TRUE,2613,1651766,NONE,CodeCov,1679,4648,331,0.03333333333333333,NA,NA
googleway,2018-09-17,Accesses Google Maps APIs to Retrieve Data and Plot Maps,1,3,TRUE,TRUE,TRUE,0,6209,Travis,CodeCov,39,179,14,25.566666666666666,NA,NA
ggspatial,2020-07-12,Spatial Data Framework for ggplot2,1,14,TRUE,FALSE,TRUE,3,6249,NONE,CodeCov,21,245,14,0.1,NA,NA
leaflet,2019-11-16,"Create Interactive Web Maps with the JavaScript 'Leaflet'
Library",1,9,TRUE,FALSE,TRUE,69,73229,Travis,NONE,436,632,102,11.2,NA,NA
mapview,2020-08-11,Interactive Viewing of Spatial Data in R,2,10,FALSE,FALSE,TRUE,4,22147,NONE,CodeCov,72,320,38,30.3,NA,NA
plotly,2020-04-04,Create Interactive Web Graphics via 'plotly.js',2,21,TRUE,FALSE,TRUE,190,189818,Travis,NONE,573,1813,122,0.03333333333333333,NA,NA
rasterVis,2020-06-16,Visualization Methods for Raster Data,5,5,FALSE,FALSE,FALSE,13,10293,Travis,NONE,16,57,6,55.03333333333333,NA,NA
tmap,2020-09-15,Thematic Maps,2,13,TRUE,TRUE,TRUE,5,25620,Appveyor,NONE,86,462,29,0.23333333333333334,NA,NA
