package,published,title,depends_count,suggests_count,tidyverse_happy,has_vignette_build,has_tests,reverse_count,dl_last_month,ci,test_coverage,forks,stars,watchers,last_commit,last_issue_closed,contributors
cartography,2018-04-30,Thematic Cartography,1,4,FALSE,TRUE,FALSE,0,1244,Travis,NONE,15,102,10,NA,2.433333333333333,5
ggplot2,2016-12-30,Create Elegant Data Visualisations Using the Grammar of Graphics,1,15,TRUE,TRUE,TRUE,1266,449119,"Travis, Appveyor",CodeCov,1204,3157,313,NA,0.06666666666666667,152
googleway,2018-05-25,Accesses Google Maps APIs to Retrieve Data and Plot Maps,1,3,TRUE,TRUE,TRUE,1,2657,Travis,CodeCov,16,93,9,NA,0.4666666666666667,3
leaflet,2018-06-04,"Create Interactive Web Maps with the JavaScript 'Leaflet'
Library",1,10,TRUE,FALSE,TRUE,36,28139,Travis,NONE,302,471,95,NA,0.1,18
mapview,2018-04-28,Interactive Viewing of Spatial Data in R,2,6,FALSE,FALSE,TRUE,4,10043,Travis,CodeCov,30,162,34,NA,0.7333333333333333,1
plotly,2017-07-29,Create Interactive Web Graphics via 'plotly.js',2,18,TRUE,FALSE,TRUE,69,56035,Travis,NONE,466,1242,114,NA,0,24
rasterVis,2018-06-02,Visualization Methods for Raster Data,4,4,FALSE,FALSE,FALSE,10,7154,Travis,NONE,12,37,6,NA,1,13
tmap,2018-04-10,Thematic Maps,2,7,FALSE,TRUE,FALSE,1,7434,"Travis, Appveyor",CodeCov,42,224,18,NA,0,13
