package,published,title,depends_count,suggests_count,tidyverse_happy,has_vignette_build,has_tests,reverse_count,dl_last_month,ci,test_coverage,forks,stars,watchers,last_commit,last_issue_closed,contributors
cartogram,2018-12-01,Create Cartograms with R,NA,2,FALSE,FALSE,FALSE,0,3532,Travis,NONE,8,67,6,0.4,3.7,3
geogrid,2018-12-11,Turn Geospatial Polygons into Regular or Hexagonal Grids,NA,3,FALSE,FALSE,TRUE,1,1142,Travis,CodeCov,20,270,15,0.16666666666666666,0.3333333333333333,0
geofacet,2018-03-29,ggplot2 Faceting Utilities for Geographical Data,1,6,TRUE,TRUE,TRUE,0,618,NA,NA,NA,NA,NA,NA,NA,NA
globe,2017-05-12,"Plot 2D and 3D Views of the Earth, Including Major Coastline",3,NA,NA,FALSE,FALSE,0,314,NA,NA,NA,NA,NA,NA,NA,NA
linemap,2017-09-15,Line Maps,1,NA,FALSE,FALSE,FALSE,0,249,NA,NA,NA,NA,NA,NA,NA,NA
